track_id,name,album,year,lyrics,has_lyrics,compound,pos,neg,neu,word_count,unique_words,lexical_richness
0uOeAmfdyaekD2RIGwCDwq,Glass Eyes,A Moon Shaped Pool,2016,"Hey it's me
I just got off the train
A frightening place
The faces are concrete grey

And I'm wondering, should I turn around?
Buy another ticket
Panic is coming on strong
So cold, from the inside out

No great job
No message coming in
And you're so small
Glassy-eyed light of day
Glassy-eyed light of day

The path trails off
And heads down a mountain
Through the dry bush, I don't know where it leads
I don't really care
And the path trails off
And heads down a mountain
Through the dry bush, I don't know where it leads
I don't really care

I feel this love to the core
I feel this love to the core",True,0.3422,0.131,0.128,0.741,57,39,0.6842105263157895
1GnFQL9XnxrXFloKm1yjuW,The Numbers,A Moon Shaped Pool,2016,"It holds us like a phantom
The touch is like a breeze
It shines its understanding
See the moon smiling

Open on all channels
Ready to receive
And we're not at the mercy
Of your chimeras and spells
Yur chimeras and spells
Mmmhm

We are of the earth
To her we do return
The future is inside us
It's not somewhere else
It's not somewhere else
It's not somewhere else

(One day at a time)
One day at a time

We call upon the people
People have this power
The numbers don't decide
Your system is a lie
The river running dry
The wings of a butterfly
And you may pour us away like soup
Like we're pretty broken flowers
We'll take back what is ours
Take back what is ours

One day at a time",True,0.9098,0.13,0.036,0.834,68,50,0.7352941176470589
7KHQtpLpoIV3Wfu22YQT8y,Present Tense,A Moon Shaped Pool,2016,"This dance
This dance
Is like a weapon
Is like a weapon
Of self defense
Of self defense
Against the present
Against the present
The present tense

No, I won't get heavy
No, don't get heavy
Keep it light and
Keep it moving
I am doing
No harm

As my world
Comes crashing down
I'll be dancing
Freaking out
Deaf dumb and blind

In you I'm lost
In you I'm lost

I won't turn around or the penny drops
I won't stop now, I won't slack off
Or all this love will be in vain

To stop from falling down a mine
It's no one's business but mine
Where all this love has been in vain

In you I'm lost
In you I'm lost

In you I'm lost
In you I'm lost",True,-0.9389,0.121,0.265,0.614,53,34,0.6415094339622641
1Rd5OVjqDAr5xC96MHt448,Daydreaming,A Moon Shaped Pool,2016,"Dreamers
They never learn
They never learn

Beyond the point
Of no return
Of no return

It's too late
The damage is done
The damage is done

This goes
Beyond me
Beyond you

A white room
By a window
Where the Sun comes through

We are
Just happy to serve
Just happy to serve you",True,-0.34,0.113,0.166,0.721,26,17,0.6538461538461539
4mRSbPLnOm54ttkTYvxxSY,Decks Dark,A Moon Shaped Pool,2016,"Then into your life, there comes a darkness
There's a spacecraft blocking out the sky
And there's nowhere to hide
You run to the back and you cover your ears
But it's the loudest sound you've ever heard
And all we trapped, rag doll cloth people
We are helpless to resist
Into our darkest hour

But it was just a laugh, just a laugh
Just a laugh, just a laugh
Even at this angle
And so we crumble
A 10-ton head, made of wet sand
Oh this dread circumference
You gotta be kidding me
The grass grows over me
Your face in the glass, in the glass
It was just a laugh, just a laugh
It's whatever you say it is
In split infinities

Then in your life, there comes a darkness
There's a spacecraft blocking out the sky
And there's nowhere to hide
You run to the back and you cover your ears
It's the loudest sound you've ever heard
In your darkest hour

When you've had enough of me
When you've had enough of me
Sweet times
When you've had enough of me
When you've had enough of me
Sweet times
Sweet times
Sweet times
Sweet times",True,0.9773,0.216,0.125,0.66,87,49,0.5632183908045977
3DpuYpzkvUWXbmzCm6pfzR,Burn the Witch,A Moon Shaped Pool,2016,"Stay in the shadows
Cheer at the gallows
This is a round up

This is a low flying panic attack
Sing a song on the jukebox that goes

Burn the witch
Burn the witch
We know where you live

Red crosses on wooden doors
And if you float you burn
Loose talk around tables
Abandon all reason
Avoid all eye contact
Do not react
Shoot the messengers

This is a low flying panic attack
Sing the song of sixpence that goes

Burn the witch
Burn the witch
We know where you live
We know where you live",True,-0.9778,0.045,0.292,0.662,53,35,0.660377358490566
0eLVt8CGVdNnyMcfP38kDi,Desert Island Disk,A Moon Shaped Pool,2016,"Now as I go upon my way
So let me go upon my way
Born of a light
Born of a light

The wind rushing round my open heart
An open ravine
In my spirit light
Totally alive
In my spirit light

Through an open doorway
Across a street
To another life
And catching my reflection in a window
Switching on a light
One I didn’t know
Totally alive
Totally released

Waking, waking up from shutdown
From a thousand years of sleep
Yeah you, you know what I mean
You know what I mean
You know what I mean

Standing on the edge of you
You know what I mean
You know what I mean
You know what I mean
Different types of love
Different types of love
Different types of love
Are possible
Are possible
Are possible
Are possible",True,0.9719,0.169,0.0,0.831,72,38,0.5277777777777778
6nOsTV3cMjLh3k6Wpk468L,Ful Stop,A Moon Shaped Pool,2016,"You really messed up everything

You really messed up everything
If you could take it all back again
Strike up what's in the box
Why should I be good if you're not?
This is a foul tasting medicine
A foul tasting medicine
To be trapped in your full stop

Truth will mess you up
Truth will mess you up
Truth will mess you up
Truth will mess you up
Truth will mess you up
Truth will mess you up
Truth will mess you up
Truth will mess you up
Truth will mess you up
(All the good times)
(All the good times)
(All the good times)
(All the good times)
(All the good times)
(All the good times)
(All the good times)
(All the good times)

When you take me back
Take me back again
When you take me back
Take me back again

You really me...
You really messed up... aaaaah...",True,0.845,0.233,0.188,0.579,68,20,0.29411764705882354
3YQVYTkonczhXyj31HH4AK,Tinker Tailor Soldier Sailor Rich Man Poor Man Beggar Man Thief,A Moon Shaped Pool,2016,"All the holes at once are coming alive
Set free
Out of sight and out of mind
The lonely and their prey

The ones you light your fires to keep away
Crawling out upon its belly
And all you have to do is say yeah

All the birds stay up in the trees
All the fish swim down too deep
The lonely and their prey
I am here
Come to me before it's too late

The one you light your fires to keep away
Is crawling out upon its belly
And all you have to do is say yeah",True,0.6486,0.096,0.047,0.857,37,27,0.7297297297297297
07XaOyTS5hyaWiUK1Bc3bR,True Love Waits,A Moon Shaped Pool,2016,"I'll drown my beliefs
To have your babies
I'll dress like your niece
And wash your swollen feet

Just don't leave
Don't leave

I'm not living
I'm just killing time
Your tiny hands
Your crazy kitten smile

Just don't leave
Don't leave

And true love waits
In haunted attics
And true love lives
On lollipops and crisps

Just don't leave
Don't leave

.
.",True,-0.4545,0.24,0.216,0.544,33,26,0.7878787878787878
