track_id,name,album,year,lyrics,has_lyrics,compound,pos,neg,neu,word_count,unique_words,lexical_richness
1UuaWKypSkIHxFZD03zw4m,The Tourist,OK Computer,1997,"It barks at no-one else but me
like it's seen a ghost
I guess it seen the sparks,
a flowing no one else would know
Hey man slow down, slow down,
idiot slow down, slow down

Sometimes I get overcharged
that's when you see sparks
You ask me where the hell I'm going
at thousand feet per second?
Hey man, slow down, slow down,
idiot slow down, slow down

Hey man, slow down, slow down,
idiot slow down, slow down.",True,-0.9757,0.033,0.261,0.706,45,26,0.5777777777777777
2PDQReEXBViVwkrbQ34vd7,Climbing Up the Walls,OK Computer,1997,"I am the key to the lock in your house,
that keeps your toys in the basement
And if you get too far inside,
you'll only see my reflection
It's always best when the light is off,
I am the pick in the ice
Do not cry out or hit the alarm,
we're friends till we die

And either way you turn,
I'll be there, open up your skull
I'll be there, climbing up the walls

It's always best when the light is off,
it's always better on the outside
Fifteen blows to the back of my head,
fifteen blows to your mind
So tuck the kids in safe tonight,
shut the eyes in the cupboard
I’ve got the smell of a local man,
Who’s got the loneliest feeling

That either way you turn,
I'll be there, open up your skull
I'll be there, climbing up the walls

Climb up the walls. climb up the walls",True,0.8923,0.123,0.056,0.822,67,50,0.746268656716418
4SrRrB27n7fiRkQcPoKfpk,Motion Picture Soundtrack,Kid A,2000,,False,,,,,0,0,
4h37RgtBg9iynN3BIL5lFU,Morning Bell,Kid A,2000,"The morning bell
The morning bell
Had a null encounter
Release me
Release me

You can keep the furniture
A bump on the head
Howling down the chimney
Release me
Release me
Please
Release me
Release me

Where'd you park the car
Where'd you park the car
Clothes are all alone with the furniture
Now I might as well
I might as well

Sleepy jack the fire drill
Running around around around...

Cut the kids in half
Cut the kids in half
Cut the kids in half

I wanted to tell you but you never listened
You never understand
I wanted to tell you but you never listened
You never understand
Cos I'm walking walking walking...

The lights are on but nobody's home
Everybody wants to be a
The lights are on but nobody's home
Everybody wants to be a singer
Walking walking walking...

The lights are on but nobody's at home
Everybody wants to be a
Everyone wants to be a friend
Nobody wants to be a singer
Walking walking walking...",True,0.4939,0.054,0.046,0.9,93,44,0.4731182795698925
4aeCuOowYXJXrMZsVHZbfF,Untitled,Kid A,2000,,False,,,,,0,0,
1W5XugQJGhnSATMI5n002M,Idioteque,Kid A,2000,"Who's in the bunker?
Who's in the bunker?
Women and children first
And children first
And children
I'll laugh until my head comes off
I'll swallow till I burst
Until I burst
Until I

Who's in bunker?
Who's in bunker?
I have seen too much
I haven't seen enough
You haven't seen it
I'll laugh until my head comes off
Women and children first
And children first
And children

Here I'm allowed
Everything all of the time
Here I'm allowed
Everything all of the time

Ice age coming
Ice age coming
Let me hear both sides
Let me hear both sides
Let me hear both
Ice age coming
Ice age coming
Throw it in the fire
Throw it in the fire
Throw it on the

We're not scaremongering
This is really happening
Happening
We're not scaremongering
This is really happening
Happening
Mobiles working
Mobiles chirping
Take the money and run
Take the money and run
Take the money

Here I'm allowed
Everything all of the time
Here I'm allowed
Everything all of the time

Here I'm allowed
Everything all of the time
Here I'm allowed
Everything all of the time",True,0.6553,0.042,0.025,0.933,98,34,0.3469387755102041
4Wgj6jzoI2gYlumXdYAB8U,The National Anthem,Kid A,2000,"Everyone
Everyone around here
Everyone is so near
What's going on?
What's going on?

Everyone
Everyone is so near
Everyone has got the fear
What's going on?
What's going on?

What's going on?
What's going on?
What's going on?",True,-0.6322,0.0,0.099,0.901,25,7,0.28
3QDahKSqLwYJYQRbILdzS6,Kid A,Kid A,2000,"I slipped away
I slipped on a little white lie
We've got heads on sticks
You've got ventriloquists
We've got heads on sticks
You've got ventriloquists
Standing in the shadows at the end of my bed
Standing in the shadows at the end of my bed
Standing in the shadows at the end of my bed
Standing in the shadows at the end of my bed
Rats and children follow me out of town
Rats and children follow me out of their homes
Watch it",True,0.0,0.0,0.0,1.0,41,19,0.4634146341463415
2kRFrWaLWiKq48YYVdGcm8,Everything In Its Right Place,Kid A,2000,"Kid A, Kid A
Kid A, Kid A
God sent a spark

Everything, everything
Everything, everything
In its right place
In its right place
In its right place
In its right place

Yesterday I woke up sucking a lemon
Yesterday I woke up sucking a lemon
Yesterday I woke up sucking a lemon
Yesterday I woke up sucking a lemon

Everything
Everything
Everything
In its right place
In its right place
In its right place
Right place

There are two colours in my head
There are two colours in my head
What, what is that you tried to say?
What, what was that you tried to say?
Tried to say
Tried to say
Tried to say
Tried to say

Everything
Everything
Everything",True,0.5204,0.038,0.0,0.962,67,16,0.23880597014925373
2rtGaCAeYtmcIvuZsvgTf6,How to Disappear Completely,Kid A,2000,"That there
That's not me
I go
Where I please
I walk through walls
I float down the Liffey
I'm not here
This isn't happening
I'm not here
I'm not here

In a little while
I'll be gone
The moment's already passed
Yeah it's gone
And I'm not here
This isn't happening
I'm not here
I'm not here

Strobe lights and blown speakers
Fireworks and hurricanes
I'm not here
This isn't happening
I'm not here
I'm not here",True,0.5423,0.06,0.0,0.94,21,18,0.8571428571428571
0xivCtzVVrdeq32s8EnOO6,In Limbo,Kid A,2000,"Being the first in the Irish Sea
I got a message I can't read
Another message I can't read

Being the first in the Irish Sea
I got a message I can't read
Another message I can't read

I'm on your side
Nowhere to hide
Trapdoors that open
I spiral down

You're living in a fantasy
You're living in a fantasy

I'm lost at sea
Don't bother me
I've lost my way
I've lost my way

You're living in a fantasy
You're living in a fantasy
You're living in a fantasy
This beautiful world

Being the first in the Irish Sea
I got a message I can't read
Another message I can't read",True,0.1416,0.072,0.067,0.861,58,21,0.3620689655172414
1FoUsSi9BCTlNt2Vd7V8XA,Optimistic,Kid A,2000,"Flies are buzzing round my head
Vultures circling the dead
Picking up every last crumb
The big fish eat the little ones
The big fish eat the little ones
Not my problem, give me some
You can try the best you can
If you try the best you can
The best you can is good enough
If you try the best you can
If you try the best you can
The best you can is good enough
This one's optimistic
This one went to market
This one just came out of the swamp
This one dropped a payload
Fodder for the animals
Living on animal farm
If you try the best you can
If you try the best you can
The best you can is good enough
If you try the best you can
If you try the best you can
The best you can is good enough
I'd really like to help you, man
I'd really like to help you, man
And now this messed up millionaire
Floating around on a prison ship
If you try the best you can
If you try the best you can
The best you can is good enough
If you can try the best you can
If you try the best you can
Dinosaurs ruling the earth
Dinosaurs ruling the earth
Dinosaurs ruling the earth",True,0.9982,0.337,0.042,0.621,101,49,0.48514851485148514
4LrfsgQ5AGouvH3PlxW2PC,Treefingers,Kid A,2000,,False,,,,,0,0,
0kSDNLOdJqpGhV2vtVFWmS,Dollars and Cents,Amnesiac,2001,"There are better things to talk about
Be constructive
There are weapons we can use
Be constructive
With your blues
Even when it's only warnings
Even when you talk the war games

Oh Why don't you quiet down?
(Maybe I want peace and honesty)
Why don't you quiet down?
(Maybe I want to live in the children's land
And you know maybe, maybe I)
Why don't you quiet down?
(Maybe I'll wander the promised land
I want peace and honesty)
Why don't you quiet down?
(I want to live in the promised land
And maybe wander the children's land)
Quiet down! (Yeah, and there, there we can free)

You don't live in a business world and
You never go out and you never stay
We won our goals in a liberal world
Living in times when I could stand it, babe
All over, baby's crying
It'll all be, baby, I can see out of here
All over the planet's dead
All over the planet, so let me out of here
All over the, all over the, all over the, all over the

(Quiet down)
We are the dollars and cents and the pounds and pence
And the mark and the yen, and yeah
(Why don't you quiet down?)
We're gonna crack your little souls
We're gonna crack your little souls
(Why don't you quiet down?)
We are the dollars and cents and the pounds and pence
And the pounds and pence, and yeah
(Why don't you quiet down?)
We're gonna crack your little souls
Crack your little souls
We are the dollars and cents",True,0.33,0.09,0.068,0.842,99,51,0.5151515151515151
55q3Ro66yXWi9rsEddeEN4,Pyramid Song,Amnesiac,2001,"I jumped in the river and what did I see?
Black-eyed angels swam with me
A moon full of stars and astral cars
All the things I used to see
All my lovers were there with me
All my past and futures
And we all went to heaven in a little row boat
There was nothing to fear and nothing to doubt

I jumped into the river
Black-eyed angels swam with me
A moon full of stars and astral cars
And all the things I used to see
All my lovers were there with me
All my past and futures
And we all went to heaven in a little row boat
There was nothing to fear and nothing to doubt

There was nothing to fear and nothing to doubt
There was nothing to fear and nothing to doubt",True,0.9824,0.217,0.0,0.783,61,25,0.4098360655737705
6AIq6WIkWBoRUb6kTVY8yU,Pulk/Pull Revolving Doors,Amnesiac,2001,,False,,,,,0,0,
0tDn82XkoueVV5q9G7OUAv,Packt Like Sardines In a Crushd Tin Box,Amnesiac,2001,,False,,,,,0,0,
5JZ1jTanqLWVuThmZ6XRAc,I Might Be Wrong,Amnesiac,2001,"I might be wrong
I might be wrong
I could have sworn
I saw a light coming on

I used to think
I used to think
There is no future left at all
I used to think

Open up, begin again
Let's go down the waterfall
Think about the good times
And never look back
Never look back

What would I do?
What would I do?
If I did not have you?

Open up, let me in
Let's go down the waterfall
Have ourselves a good time
It's nothing at all
Nothing at all
Nothing at all",True,-0.4836,0.061,0.094,0.844,41,24,0.5853658536585366
7Hg6a7tZsVTkXnBUepjZU6,You And Whose Army?,Amnesiac,2001,"Come on, come on
You think you'll drive me crazy?
Well, come on, come on

You and whose army?
You and your cronies

Come on, come on
Holy Roman Empire
Come on if you think
Come on if you think
You can take us on
You can take us on

You and whose army?
You and your cronies

You forget so easy
We ride tonight
We ride tonight
Ghost horses
Ghost horses
We ride tonight
We ride tonight
Ghost horses
Ghost horses
Ghost horses",True,-0.8176,0.06,0.168,0.772,45,18,0.4
5xJc58mBWz68WhwU2n5seR,Life In a Glasshouse,Amnesiac,2001,,False,,,,,0,0,
3LpAIBGaRKXqgDzEV25Bh7,Hunting Bears,Amnesiac,2001,,False,,,,,0,0,
1irS6wtXCUUF5ytfPqOzpM,Like Spinning Plates,Amnesiac,2001,"While you make pretty speeches
I'm being cut to shreds
You feed me to the lions
A delicate balance

And this just feels like spinning plates
I'm living in cloud cuckoo land
And this just feels like spinning plates
My body's floating down the muddy river",True,0.743,0.183,0.041,0.777,25,21,0.84
521OhfIeThXJKiTyz0m883,Knives Out,Amnesiac,2001,"I want you to know
He's not coming back
Look into my eyes
I'm not coming back

So knives out
Catch the mouse
Don't look down
Shove it in your mouth

If you'd been a dog
They would've drowned you at birth

Look into my eyes
It's the only way you'll know I'm telling the truth

So knives out
Cook him up
Squash his head
Put him in the pot

I want you to know
He's not coming back
He's bloated and frozen
Still there's no point in letting it go to waste

So knives out
Catch the mouse
Squash his head
Put him in the pot",True,-0.7184,0.044,0.08,0.877,48,30,0.625
09rXQjOX61UGL36z76q8OS,Morning Bell/Amnesiac,Amnesiac,2001,,False,,,,,0,0,
5Qv2Nby1xTr9pQyjkrc94J,All I Need,In Rainbows,2007,"I'm the next act
Waiting in the wings

I'm an animal
Trapped in your hot car

I am all the days
That you choose to ignore

You are all I need
You are all I need
I'm in the middle of your picture
Lying in the reeds

I'm a moth
Who just wants to share your light

I'm just an insect
Trying to get out of the night

I only stick with you
Because there are no others

You are all I need
You're all I need
I'm in the middle your picture
Lying in the reeds

It's all wrong
It's all right
It's all wrong",True,-0.9578,0.019,0.185,0.796,36,28,0.7777777777777778
6yiSyupeI7KYdBZKJdnIUO,Go Slowly,In Rainbows,2007,"Over here
Come slowly
Come slowly to me
I've been waiting
Patient
Patiently
I didn't
But now I can see

That there's a way out
That there's a way out

That there's a way out
That there's a way out
That there's a way out",True,0.0,0.0,0.0,1.0,18,8,0.4444444444444444
4T1iiabe7G0UjWQJCY6NE2,Videotape,In Rainbows,2007,"When I'm at the pearly gates
This will be on my videotape, my videotape
Mephistopheles is just beneath
and he's reaching up to grab me

This is one for the good days
and i have it all here
In red, blue, green
Red, blue, green

You are my center
When i spin away
Out of control on videotape
On videotape
On videotape
On videotape

This is my way of saying goodbye
Because I can't do it face to face
I'm talking to you after it's too late
From my videotape

No matter what happens now
You shouldn't be afraid
Because I know today has been the most perfect day
I've ever seen",True,0.7645,0.085,0.019,0.896,43,33,0.7674418604651163
4Nckr2LBLkgNOdMadwNAxc,Down Is The New Up,In Rainbows,2007,"Get yourself together
Let the light pour in
Pour yourself a hot bath, pour yourself a drink
Nothing's gonna happen without a warning
Down is the new up
What is up, buttercup
Down is the new up, is the new up

Your services are not required
Your future's bleak, you're so last week

Ladies and gentlemen, without a safety net
I shall now perform a 180 flip-flop
I shall now amputate, I shall now contort
Because down is the new up
What if I just flip-flopped?
Down is the new up
Down is the new up
Down is the new up, is the new up

You're on Candid Camera
The chink in your armor
Topsy turvy town, topsy turvy town
Shake your pockets out
Pass it on, pass it down
Topsy turvy town, topsy turvy town",True,-0.2491,0.016,0.031,0.953,64,41,0.640625
49oVFSbl8QdRAXktelJZWC,MK 1,In Rainbows,2007,,False,,,,,0,0,
15irEKZ9D6FQqLoZ1qJ1Cx,Faust Arp,In Rainbows,2007,"One two three four

Wakey wakey
rise and shine
it's on again, off again, on again
watch me fall
like dominos
in pretty patterns
Fingers in the blackbird pie
i'm tingling tingling tingling
it's what you feel now
what you ought to, what you ought to
reasonable and sensible
dead from the neck up
because im stuffed, stuffed, stuffed
we thought you had it in you
but no, no, no
for no real reason

Squeeze the tubes and empty bottles
take a bow take a bow take a bow
it's what you feel now
what you ought to
what you ought to
an elephant thats in the room is
tumbling tumbling tumbling
in duplicate and duplicate
plastic bags and
duplicate and triplicate
dead from the neck up
guess im stuffed, stuffed, stuffed
we thought you had it in you
but no, no, no
exactly where do you get off
Is enough is enough is enough
I love you but enough is enough, enough
a last stop
There's no real reason

you've got a head full of feathers
you got melted to butter",True,-0.976,0.047,0.174,0.779,86,55,0.6395348837209303
0YJ9FWWHn9EfnN0lHwbzvV,Jigsaw Falling Into Place,In Rainbows,2007,"Just as you take my hand
Just as you write my number down
Just as the drinks arrive
Just as they play your favourite song
As your bad day disappears
No longer wound up like a spring
Before you've had too much
Come back and focus again

The walls are bending shape
You got a Cheshire cat grin
All blurring into one
This place is on a mission
Before the night owl
Before the animal noises
Closed circuit cameras
Before you comatose

Before you run away from me
Before you're lost between the notes
The beat goes round and round
The beat goes round and round
I never really got there
I just pretended that I had
Words are blunt instruments
Words are a sawn off shotguns

Come on and let it out
Come on and let it out
Come on and let it out
Come on and let it out

Before you run away from me
Before you're lost between the notes
Just as you take the mic
Just as you dance, dance, dance

Jigsaw falling into place
So there is nothing to explain
You eye each other as you pass
She looks back and you look back
Not just once
Not just twice
Wish away your nightmare
Wish away the nightmare
You've got the light you can feel it on your back
A light you can feel it on your back
Jigsaw falling into place",True,-0.711,0.05,0.082,0.867,106,70,0.660377358490566
48X4D1FYOShPz2VF3YdfCF,House Of Cards,In Rainbows,2007,"I don't want to be your friend
I just want to be your lover
No matter how it ends
No matter how it starts

Forget about your house of cards
And I'll do mine
Forget about your house of cards
And I'll do mine

Fall off the table,
Get swept under
Denial, denial

The infrastructure will collapse
Voltage spikes
Throw your keys in the bowl
Kiss your husband goodnight

Forget about your house of cards
And I'll do mine
Forget about your house of cards
And I'll do mine

Fall off the table,
And get swept under

Denial, denial
Denial, denial
Your ears should be burning
Denial, denial
Your ears should be burning
Denial, denial",True,-0.3907,0.093,0.137,0.77,56,27,0.48214285714285715
02ppMPbg1OtEdHgoPqoqju,Reckoner,In Rainbows,2007,"Reckoner
Can't take it with you
Dancing for your pleasure

You are not to blame for
Bittersweet distractors
Dare not speak its name
Dedicated to all human, all human beings

Because we separate
Like ripples on a blank shore
Because we separate (In rainbows)
Like ripples on a blank shore (In rainbows)

Reckoner
Take me with you
Dedicated to all human, all human beings",True,0.9375,0.229,0.018,0.753,33,20,0.6060606060606061
6Z467S228pBaUaAaMMBIHl,MK 2,In Rainbows,2007,"(instrumental)

(Grazie a Braska per questo testo)",True,0.0,0.0,0.0,1.0,6,6,1.0
3HPLfZhQUds6N6tZ4WiApn,4 Minute Warning,In Rainbows,2007,"This is just a nightmare
But soon I'm going to wake up
Someone's gonna bring me around

Hiding from the bombers
Wading through the fields
Running in the half light

Running to ????
Just like everybody
Could ????

Running through the underground
And this is your warning
4 minute warning

I don't wanna hear it
I don't wanna grow old
I just wanna run and hide

Now I'm in a nightmare
But soon I'm gonna wake up
Someone's gonna bring me 'round

This is your warning
4 minute warning",True,-0.932,0.034,0.189,0.778,37,26,0.7027027027027027
35YyxFpE0ZTOoqFx5bADW8,Nude,In Rainbows,2007,"Don't get any big ideas
They're not gonna happen

You paint yourself white
And fill up with noise
But there'll be something missing

Now that you've found it, it's gone
Now that you feel it, you don't
You've gone off the rails

So don't get any big ideas
They're not gonna happen
You'll go to hell
For what your dirty mind
Is thinking",True,-0.9331,0.0,0.179,0.821,24,19,0.7916666666666666
4wajJ1o7jWIg62YqpkHC7S,Weird Fishes/ Arpeggi,In Rainbows,2007,,False,,,,,0,0,
4pWIwnnqx8k01fuF95UMIg,Bodysnatchers,In Rainbows,2007,"I do not
Understand
What it is
I've done wrong
Full of holes
Check the pulse
Blink your eyes
One for yes
Two for no

I have no idea what I am talking about
I'm trapped in this body and can't get out
Ooooohhhh

Make a sound
Move back home
Get an invitation
With the edges
Sawn off

I have no idea what you are talking about
I'm trapped in this body and can't get out
Ooooohhhh

Has the light gone out for you?
Because the light's gone out for me
It is the 21st century
It is the 21st century
You can fight it like a dog
And they brought me to my knees
They got scared and they put me in
They got scared and they put me in
All the lies run around my face
All the lies run around my face
And for anyone else to see
And for anyone else to see

I'm alive

I've seen it coming",True,-0.967,0.043,0.168,0.789,69,49,0.7101449275362319
4oXg7xT4ksBxHTx8PcmSXw,15 Step,In Rainbows,2007,"How come I end up where I started
How come I end up where I belong
Won't take my eyes off the ball again
You reel me out the you cut the string

How come I end up where I started
How come I end up where I belong
Won't take my eyes off the ball again
First you reel me out and then you cut the string

You used to be alright
What happened?
Did the cat get your tongue
Did your string come undone
One by one
One by one
It comes to us all
It's as soft as your pillow

You used to be alright
What happened?
Etcetera etcetera
Fads for whatever (Yeah!)
15 steps
Then a shear drop

How come I end up where I started?
How come I end up where I went wrong?
Won't take my eyes off the ball again
You reel me out then you cut the string",True,-0.8295,0.026,0.083,0.89,64,30,0.46875
5MjwOoU9YISfMujFrjEwxu,Up On The Ladder,In Rainbows,2007,"I'm stuck in the tardis
Trapped in hyperspace
One minute snake charming
The next in a motorcade

All the right moves in
And in the right places
Watch me dance
I'm a puppet
You can almost see the strings

Give me an answer
Give me a line
I've been climbing up this ladder
I've been wasting my time

Up on the ladder
We are tied to the stake
Up on the ladder
We wait for you mistake

Up on the ladder
Trying to call out your name
Up on the ladder
You're all the fucking same",True,-0.6908,0.037,0.103,0.86,40,34,0.85
1mM2u5TRMdUKsIfZKEI6yJ,Last Flowers,In Rainbows,2007,"Appliances have gone berserk
I cannot keep up
Treading on people's toes
Snot-nosed little punk

And I can't face the evening straight
You can offer me escape
Houses move and houses speak
If you take me then you'll get relief
relief, relief, relief, ...

And if I'm gonna talk
I just wanna talk
Please don't interrupt
Just sit back and listen

Cause I can't face the evening straight
And you can offer me escape
Houses move and houses speak
If you take me then you'll get relief
relief, relief, relief, relief...

It's too much
Too bright
Too powerful

Too much
Too bright
Too powerful

Too much
Too bright
Too powerful

Too much

(Thanks to Paolo, Gerardo for these corrections)",True,0.9934,0.36,0.0,0.64,67,38,0.5671641791044776
0Hnik88ryug02UaEOTiXrE,Bangers + Mash,In Rainbows,2007,"You bit me, bit me, bit me, ow
You bit me, bit me, now I want more

I'm standing in the hall, I'm puking on the wall
It's all heading south to the Conger Hill
The bangers and the mash, the negatives for cash
You're either in the club, baby, or you're not
Whatever turns you on, whatever gets you up
Chief of Police or Vice Chancellor
Lord and Lady blah blah, the vicar and the judge
You're all dancing to my little red book

Because you bit me, bit me, bit me, ow
I got the poison, poison, and I want more

If you are on top then it is a long drop
The pyramid is power, we're changing the hour
If you are on the top then it is a long drop
If you stare into the dark the dark will stare back
Back into your soul

I'm taking you down, I'm taking you down
I'm taking you down When I go down
I'm taking you down, I'm taking you down
I'm standing in the hall, I'm puking on the wall

Yeah, because you bit me, bit me, bit me, ow
The poison, I got the poison, I got the poison now
Yeah, I got the poison",True,-0.975,0.047,0.149,0.805,82,47,0.573170731707317
135WMJorhiGvPe50XF54D9,Identikit,A Moon Shaped Pool,2016,"(A moon shaped pool
Dancing clothes won't let me in
And now I know it's never gonna be oh me)

Sweet-faced ones with nothing left inside
That we all can love, that we all can love, that we all
The sweet-faced ones with nothing left inside
That we all can love, that we all can love, that we all

And now I see you messing me around
I don’t want to know, I don’t want to know, I don’t want
When I see you messing me around
I don’t want to know, I don’t want to know, I don’t want to know

Broken hearts make it rain
Broken hearts make it rain
Broken hearts make it rain
Broken hearts make it rain
Broken hearts make it rain
Broken hearts make it rain
Broken hearts make it rain
Broken hearts make it rain
Broken hearts make it rain
Broken hearts

Broken hearts make it rain
Broken hearts make it rain
Broken hearts make it rain
Broken hearts make it rain
Broken hearts make it rain
Broken hearts make it rain
Broken hearts make it rain
Broken hearts make it rain

Pieces of a ragdoll mankind
That we can create, that we can create, that we can
Pieces of a ragdoll mankind
That we can create, that we can create

But when I see you messing me around
I don’t want to know, I don’t want to know, I don’t want
When I see you messing me around
I don’t want to know, I don’t want to know, I don’t want to know",True,-0.8658,0.118,0.135,0.747,138,27,0.1956521739130435
